{
  "intent": "confirmation",
  "qualification_status": "qualified",
  "slots_filled": {
    "transaction_type": "rent",
    "city": "Bafoussam",
    "preferred_areas": [
      "Bafoussam"
    ],
    "budget": 150000
  },
  "next_action": "NONE",
  "memory_retained": [
    "transaction_type",
    "city",
    "preferred_areas",
    "budget"
  ]
}