{
  "intent": "confirmation",
  "qualification_status": "qualified",
  "slots_filled": {
    "transaction_type": "buy",
    "property_type": "apartment",
    "city": "Bafoussam",
    "preferred_areas": [
      "Bafoussam"
    ],
    "budget": 25000000,
    "bedrooms": 3
  },
  "next_action": "NONE",
  "memory_retained": [
    "transaction_type",
    "property_type",
    "city",
    "preferred_areas",
    "budget",
    "bedrooms"
  ]
}