{
  "intent": "search_property",
  "qualification_status": "qualified",
  "slots_filled": {
    "transaction_type": "rent",
    "property_type": "appartement",
    "city": "Kribi",
    "budget": 180000,
    "bedrooms": 1,
    "preferred_areas": [
      "Dombe",
      "Mpangou"
    ],
    "move_in_date": "septembre"
  },
  "next_action": "CREATE_SEARCH_REQUEST",
  "memory_retained": [
    "transaction_type",
    "property_type",
    "city",
    "budget",
    "bedrooms",
    "preferred_areas",
    "move_in_date"
  ]
}